{
  "id": "V001",
  "experiment": "E001",
  "target": "H001",
  "kind": "session_observation",
  "observation": "Before seeing several Marin implementation details, the learner independently proposed three mechanisms for open development—external knowledge, internal commitment, and sustainable economy—and proposed evidence-based cheap PoCs followed by larger-scale testing.",
  "interpretation": "Consistent with the possibility that judgment-first prompts elicit reconstructive reasoning, but this is exploratory in-session evidence and cannot establish durable learning or comparative advantage.",
  "confidence": null,
  "provenance": "Selected structured observation from the initiating Open Learning Lab Marin learning session; learner authorized creation of this public repository and study.",
  "created_at": "2026-08-29"
}
